{"content_completion_definition":"Project content is complete only after the owner supplies the canonical art references, approved local tools, models and workflows, executes the real benchmark and identity-lock runs, records human model, identity and variant reviews plus licensing decisions, supplies source audio, and makes any desired final encoded media and publication decisions.","critical_paths":[".github/workflows/ci.yml",".github/workflows/unit-tests.yml","README.md","docs/ARCHITECTURE.md","docs/ART_DIRECTION.md","docs/ASSET_PREP.md","docs/ASSET_SPECIFICATION.md","docs/BENCHMARK_RESULTS.md","docs/BENCHMARK_REVIEW.md","docs/COMFYUI_EXECUTION.md","docs/FRAME_PREVIEW.md","docs/IDENTITY_LOCK.md","docs/IDENTITY_LOCK_RESULTS.md","docs/IDENTITY_LOCK_REVIEW.md","docs/IMAGE_STYLE_GUIDE.md","docs/MODEL_BENCHMARK.md","docs/MVP_COMPLETION.md","docs/PRODUCT_REQUIREMENTS.md","docs/QUALITY_STAGES.md","docs/VARIANT_REVIEW.md","docs/VIDEO_EXPORT.md","docs/WORKSPACE.md","pyproject.toml","schemas/ai-illustration-mvp-release.schema.json","schemas/ai-illustration-workspace-dashboard.schema.json","schemas/ai-illustration-workspace.schema.json","schemas/art-direction-profile.schema.json","schemas/art-direction-review.schema.json","schemas/asset-prep-profile.schema.json","schemas/candidate-asset.schema.json","schemas/comfyui-execution-package.schema.json","schemas/comfyui-execution-profile.schema.json","schemas/identity-lock-plan.schema.json","schemas/identity-lock-results.schema.json","schemas/identity-lock-review.schema.json","schemas/model-benchmark-plan.schema.json","schemas/model-benchmark-results.schema.json","schemas/model-benchmark-review.schema.json","schemas/paper-theater-frame-preview-package.schema.json","schemas/paper-theater-frame-render-package.schema.json","schemas/paper-theater-video-export-package.schema.json","schemas/paper-theater-video-export-profile.schema.json","schemas/review-decision.schema.json","schemas/variant-export-package.schema.json","schemas/variant-review-decision.schema.json","schemas/variant-set.schema.json","src/ai_illustration/__init__.py","src/ai_illustration/adapters/comfyui.py","src/ai_illustration/adapters/comfyui_execute.py","src/ai_illustration/adapters/comfyui_http.py","src/ai_illustration/art_direction.py","src/ai_illustration/asset_prep.py","src/ai_illustration/audio_preview.py","src/ai_illustration/benchmark_results.py","src/ai_illustration/benchmark_review.py","src/ai_illustration/catalog.py","src/ai_illustration/cli.py","src/ai_illustration/composition.py","src/ai_illustration/exporter.py","src/ai_illustration/frame_preview.py","src/ai_illustration/frame_renderer.py","src/ai_illustration/identity_lock.py","src/ai_illustration/identity_lock_results.py","src/ai_illustration/identity_lock_review.py","src/ai_illustration/model_benchmark.py","src/ai_illustration/naming.py","src/ai_illustration/paper_theater.py","src/ai_illustration/preview.py","src/ai_illustration/quality.py","src/ai_illustration/release_audit.py","src/ai_illustration/render_plan.py","src/ai_illustration/review_ui.py","src/ai_illustration/validation.py","src/ai_illustration/variant_review.py","src/ai_illustration/variants.py","src/ai_illustration/video_export.py","src/ai_illustration/video_export_execute.py","src/ai_illustration/video_export_process.py","src/ai_illustration/workspace.py","src/ai_illustration/workspace_checks.py","web/review/app.js","web/review/index.html","web/review/styles.css"],"dedicated_cli_commands":{"frame_preview":["build","check"],"video_export":["check","plan","run"],"workspace":["build","check","dashboard-check","status"]},"entry_points":{"ai-illustration":"ai_illustration.cli:main","ai-illustration-frame-preview":"ai_illustration.frame_preview:main","ai-illustration-manifest":"ai_illustration.cli:main","ai-illustration-release-audit":"ai_illustration.release_audit:main","ai-illustration-video-export":"ai_illustration.video_export:main","ai-illustration-workspace":"ai_illustration.workspace:main"},"external_prerequisites":["actual-three-family-benchmark-on-owner-hardware","approved-local-comfyui-installation","approved-local-model-and-workflow","caller-recorded-wav-audio","canonical-owner-art-reference-files","checksum-pinned-local-ffmpeg","owner-reviewed-identity-lock-runtime-evidence"],"human_decisions":["art-direction-approval","asset-prep-profile-selection","benchmark-model-selection","character-identity-selection","commercial-and-license-approval","final-aesthetic-review","identity-lock-approval","variant-acceptance"],"id":"ai-illustration-mvp-release-b3c88c08d4903d4502fe","kind":"ai-illustration-mvp-release","main_cli_commands":["adapter-check","adapter-plan","adapter-run","adapter-run-check","audio-preview-check","audio-preview-plan","catalog-compat","catalog-list","catalog-validate","composition-job","composition-job-check","export-check","frame-render","frame-render-check","paper-check","paper-plan","preview-check","preview-plan","render-plan","render-plan-check","review-ui","validate","variant-check","variant-export","variant-plan"],"prohibited_effects":["automatic-commercial-approval","automatic-final-character-selection","credential-access","external-network-from-audit","media-publication","subprocess-from-audit"],"protected_sources":["src/ai_illustration/adapters/comfyui_execute.py","src/ai_illustration/adapters/comfyui_http.py","src/ai_illustration/video_export_execute.py","src/ai_illustration/video_export_process.py","src/ai_illustration/workspace.py"],"python_requires":">=3.11","release_name":"AI Illustration Pipeline Software MVP","runtime_dependencies":[],"schema_version":"1.0","software_completion_definition":"Software MVP is complete when the release audit, repository validation, and full automated test suite succeed for all declared quality-stage, art-direction, benchmark, identity-lock, variant-review, asset-preparation, local generation, packaging, paper-theater, rendering, video-export, and workspace software gates.","version":"1.0.0","workspace_check_kinds":["audio-preview","comfyui-execution","export-package","frame-preview","frame-render","manifest-set","preview-package","render-plan","renderer-job","scene-plan","variant-set","video-export"]}
